{
  "$id": "https://hyoban.cc/data/schema/v1/trip.schema.json",
  "$schema": "https://json-schema.org/draft/2020-12/schema",
  "type": "object",
  "properties": {
    "id": {
      "type": "string",
      "pattern": "^[a-z0-9]+(?:-[a-z0-9]+)*$"
    },
    "title": {
      "type": "string",
      "minLength": 1
    },
    "start": {
      "type": "string",
      "pattern": "^\\d{4}-\\d{2}-\\d{2}$"
    },
    "end": {
      "type": "string",
      "pattern": "^\\d{4}-\\d{2}-\\d{2}$"
    },
    "music": {
      "type": "string",
      "pattern": "^[a-z0-9]+(?:-[a-z0-9]+)*$"
    },
    "note": {
      "type": "string"
    },
    "waypoints": {
      "default": [],
      "type": "array",
      "items": {
        "type": "object",
        "properties": {
          "at": {
            "anyOf": [
              {
                "type": "string",
                "pattern": "^\\d{4}-\\d{2}-\\d{2}$"
              },
              {
                "type": "string",
                "pattern": "^\\d{4}-\\d{2}-\\d{2}T\\d{2}:\\d{2}(?::\\d{2})?(?:Z|[+-]\\d{2}:\\d{2})$"
              }
            ]
          },
          "place": {
            "type": "string",
            "pattern": "^[a-z0-9]+(?:-[a-z0-9]+)*$"
          }
        },
        "required": [
          "place"
        ],
        "additionalProperties": {}
      }
    },
    "straightLegs": {
      "default": [],
      "type": "array",
      "items": {
        "type": "object",
        "properties": {
          "from": {
            "type": "string",
            "pattern": "^[a-z0-9]+(?:-[a-z0-9]+)*$"
          },
          "to": {
            "type": "string",
            "pattern": "^[a-z0-9]+(?:-[a-z0-9]+)*$"
          },
          "by": {
            "type": "string",
            "enum": [
              "ferry",
              "plane",
              "train"
            ]
          }
        },
        "required": [
          "from",
          "to",
          "by"
        ],
        "additionalProperties": {}
      }
    },
    "sameWayBack": {
      "default": [],
      "type": "array",
      "items": {
        "type": "object",
        "properties": {
          "from": {
            "type": "string",
            "pattern": "^[a-z0-9]+(?:-[a-z0-9]+)*$"
          },
          "to": {
            "type": "string",
            "pattern": "^[a-z0-9]+(?:-[a-z0-9]+)*$"
          }
        },
        "required": [
          "from",
          "to"
        ],
        "additionalProperties": {}
      }
    },
    "covers": {
      "default": [],
      "type": "array",
      "items": {
        "type": "object",
        "properties": {
          "moment": {
            "type": "string",
            "pattern": "^[0-9A-HJKMNP-TV-Z]{26}$"
          },
          "media": {
            "type": "string",
            "pattern": "^[0-9A-HJKMNP-TV-Z]{26}$"
          }
        },
        "required": [
          "moment",
          "media"
        ],
        "additionalProperties": {}
      }
    },
    "createdAt": {
      "type": "string",
      "pattern": "^\\d{4}-\\d{2}-\\d{2}T\\d{2}:\\d{2}(?::\\d{2})?(?:Z|[+-]\\d{2}:\\d{2})$"
    },
    "updatedAt": {
      "type": "string",
      "pattern": "^\\d{4}-\\d{2}-\\d{2}T\\d{2}:\\d{2}(?::\\d{2})?(?:Z|[+-]\\d{2}:\\d{2})$"
    }
  },
  "required": [
    "id",
    "title",
    "start",
    "end",
    "createdAt",
    "updatedAt"
  ],
  "additionalProperties": {}
}
