{
  "id": "2026-fixture-trip",
  "title": "样例旅程",
  "start": "2026-10-01",
  "end": "2026-10-02",
  "waypoints": [
    {
      "at": "2026-10-01T08:00:00+08:00",
      "place": "nanjing-2"
    }
  ],
  "straightLegs": [
    {
      "from": "nanjing-2",
      "to": "yantai-port",
      "by": "train"
    }
  ],
  "sameWayBack": [],
  "covers": [
    {
      "moment": "01M3VDBHC042D43KWZWE67YP1T",
      "media": "01M3VDBHC1HW3W1Z58ARMSH236"
    }
  ],
  "createdAt": "2026-09-30T20:00:00+08:00",
  "updatedAt": "2026-10-06T21:00:00+08:00"
}
