{
  "id": "2026-hefei-weekend",
  "title": "合肥周末",
  "start": "2026-07-18",
  "end": "2026-07-19",
  "waypoints": [
    {
      "at": "2026-07-18T09:00:00+08:00",
      "place": "wuwei"
    }
  ],
  "straightLegs": [],
  "sameWayBack": [],
  "covers": [
    {
      "moment": "01KXRCWQ004NEZBTXA4HG83VJV",
      "media": "01KXRCWQ01H59SQ7XSEKZJ3Y7F"
    },
    {
      "moment": "01KXTZ9E00QHWMR2C1MMHZ3QS8",
      "media": "01KXTZ9E01EQ0GVX6KDMMG1HMV"
    },
    {
      "moment": "01KXRCWQ00Y9N9DBTS7AFF7PWE",
      "media": "01KXRCWQ011K82FZB6SVC3SXER"
    },
    {
      "moment": "01KXTZ9E008DPSJMMQQ8PZ7JQA",
      "media": "01KXTZ9E01S9EG50173K0MCM0X"
    },
    {
      "moment": "01KXRCWQ004NEZBTXA4HG83VJV",
      "media": "01KXRCWQ02DZYW4VQDCJQ17120"
    },
    {
      "moment": "01KXTZ9E00QHWMR2C1MMHZ3QS8",
      "media": "01KXTZ9E02Q0WD3Q9F5KYTWXHT"
    }
  ],
  "createdAt": "2026-10-24T12:20:11+08:00",
  "updatedAt": "2026-10-24T12:20:11+08:00"
}
