{
  "id": "2025-western-sichuan-road-trip",
  "title": "床车自驾川西",
  "start": "2025-10-18",
  "end": "2025-11-05",
  "note": "Set out from Wuhu, resting a week in Xiangyang on the way.",
  "waypoints": [
    {
      "at": "2025-10-18T10:00:00+08:00",
      "place": "wuwei"
    }
  ],
  "straightLegs": [],
  "sameWayBack": [],
  "covers": [
    {
      "moment": "01K9A88V30WXXEMHF5ED5ESWJV",
      "media": "01K9A88V38NS5R47QX7T9R85BX"
    },
    {
      "moment": "01K9A88V30WXXEMHF5ED5ESWJV",
      "media": "01K9A88V34NBE35H7K9B8YZKQX"
    },
    {
      "moment": "01K96FSVQ06JWB91TA7ZH2K1ZS",
      "media": "01K96FSVQ7Z4HYJX4ZXFXCMPSF"
    },
    {
      "moment": "01K9A88V30WXXEMHF5ED5ESWJV",
      "media": "01K9A88V316RQA50H1084C8MEM"
    },
    {
      "moment": "01K9A88V30WXXEMHF5ED5ESWJV",
      "media": "01K9A88V35SSN5JDE418AR6KAH"
    },
    {
      "moment": "01K96FSVQ06JWB91TA7ZH2K1ZS",
      "media": "01K96FSVQ462XXB24SZ9QPT9MY"
    },
    {
      "moment": "01K96FSVQ06JWB91TA7ZH2K1ZS",
      "media": "01K96FSVQ2PBKH2X3XCVDTJ8V0"
    },
    {
      "moment": "01K8FQRXRG0XT9N2RQACJ71SFB",
      "media": "01K8FQRXRH5TV2EHB4QBD1H9YE"
    },
    {
      "moment": "01K9A88V30WXXEMHF5ED5ESWJV",
      "media": "01K9A88V39C2ZXSW37GF540E6R"
    }
  ],
  "createdAt": "2025-10-18T00:00:00+08:00",
  "updatedAt": "2026-10-19T20:01:44+08:00"
}
